<?xml version="1.0" encoding="UTF-8"?>
<personas xmlns:xsi="http://www.w3.org/2001/XMLSchema-instance"
        xsi:noNamespaceSchemaLocation="ej6_2.xsd">
    <persona fech-nac="1996-12-18">
        <datos >
            <nombre>Nombre</nombre>
            <apellidos>Aleppido</apellidos>
            <dni>DNI</dni>
        </datos>
        <comentario> CAASFASEAFEA</comentario>
        <forma-de-pago numero="111111111">Tarjeta</forma-de-pago>
    </persona>
    <persona fech-nac="1996-12-18">
        <datos>
            <nombre>Nombre</nombre>
            <apellidos>Aleppido</apellidos>
            <dni>DNI</dni>
        </datos>
        <comentario> CAASFASEAFEA</comentario>
        <forma-de-pago numero="111111111">Transferencia</forma-de-pago>
    </persona>


</personas>